{
  "schema-version": "2026-10-25",
  "name": "Schedule-Name",
  "base": "Off",
  "annotations": {},
  "digests": {
    "schedule": "sha256:f5145b511e4551d7e071434f172ae2f56d05a09166dee6a00b12b2888906b883"
  },
  "week": {
    "MON": [
      {
        "start": "00:00",
        "end": "06:07",
        "state": "Off"
      },
      {
        "start": "06:07",
        "end": "09:52",
        "state": "Medium"
      },
      {
        "start": "09:52",
        "end": "00:00",
        "state": "Off"
      }
    ],
    "TUE": [
      {
        "start": "00:00",
        "end": "00:00",
        "state": "Off"
      }
    ],
    "WED": [
      {
        "start": "00:00",
        "end": "00:00",
        "state": "Off"
      }
    ],
    "THU": [
      {
        "start": "00:00",
        "end": "00:00",
        "state": "Off"
      }
    ],
    "FRI": [
      {
        "start": "00:00",
        "end": "00:00",
        "state": "Off"
      }
    ],
    "SAT": [
      {
        "start": "00:00",
        "end": "00:00",
        "state": "Off"
      }
    ],
    "SUN": [
      {
        "start": "00:00",
        "end": "00:00",
        "state": "Off"
      }
    ]
  },
  "transitions": [
    {
      "time": "06:07",
      "days": [
        "MON"
      ],
      "state": "Medium",
      "cron": {
        "posix": "7 6 * * 1",
        "aws": "7 6 ? * MON *"
      }
    },
    {
      "time": "09:52",
      "days": [
        "MON"
      ],
      "state": "Off",
      "cron": {
        "posix": "52 9 * * 1",
        "aws": "52 9 ? * MON *"
      }
    }
  ],
  "warnings": [
    {
      "code": "preview-approximate",
      "message": "…"
    }
  ]
}
