{
  "schema-version": "2026-10-25",
  "name": "Schedule-Name",
  "base": "Off",
  "annotations": {},
  "digests": {
    "schedule": "sha256:498e027f2dc84d09bbeca9eee02bce96ace4998c75a5a80a267b1209d3dd7f22"
  },
  "week": {
    "MON": [
      {
        "start": "00:00",
        "end": "09:00",
        "state": "Off"
      },
      {
        "start": "09:00",
        "end": "17:00",
        "state": "Medium"
      },
      {
        "start": "17:00",
        "end": "00:00",
        "state": "Off"
      }
    ],
    "TUE": [
      {
        "start": "00:00",
        "end": "00:00",
        "state": "Off"
      }
    ],
    "WED": [
      {
        "start": "00:00",
        "end": "00:00",
        "state": "Off"
      }
    ],
    "THU": [
      {
        "start": "00:00",
        "end": "00:00",
        "state": "Off"
      }
    ],
    "FRI": [
      {
        "start": "00:00",
        "end": "09:00",
        "state": "Off"
      },
      {
        "start": "09:00",
        "end": "17:00",
        "state": "Medium"
      },
      {
        "start": "17:00",
        "end": "00:00",
        "state": "Off"
      }
    ],
    "SAT": [
      {
        "start": "00:00",
        "end": "09:00",
        "state": "Off"
      },
      {
        "start": "09:00",
        "end": "17:00",
        "state": "Medium"
      },
      {
        "start": "17:00",
        "end": "00:00",
        "state": "Off"
      }
    ],
    "SUN": [
      {
        "start": "00:00",
        "end": "09:00",
        "state": "Off"
      },
      {
        "start": "09:00",
        "end": "17:00",
        "state": "Medium"
      },
      {
        "start": "17:00",
        "end": "00:00",
        "state": "Off"
      }
    ]
  },
  "transitions": [
    {
      "time": "09:00",
      "days": [
        "MON",
        "FRI",
        "SAT",
        "SUN"
      ],
      "state": "Medium",
      "cron": {
        "posix": "0 9 * * 0-1,5-6",
        "aws": "0 9 ? * SUN-MON,FRI-SAT *"
      }
    },
    {
      "time": "17:00",
      "days": [
        "MON",
        "FRI",
        "SAT",
        "SUN"
      ],
      "state": "Off",
      "cron": {
        "posix": "0 17 * * 0-1,5-6",
        "aws": "0 17 ? * SUN-MON,FRI-SAT *"
      }
    }
  ],
  "warnings": [
    {
      "code": "repeated-weekday",
      "line": 9,
      "column": 32,
      "message": "…",
      "excerpt": {
        "text": "> - `09:00` to `17:00` FRI-MON,SUN",
        "marker": "                               ^"
      }
    }
  ]
}
