{
  "schema-version": "2026-10-25",
  "name": "Schedule-Name",
  "base": "Minimum",
  "annotations": {},
  "digests": {
    "schedule": "sha256:4e089996e01b833c9fdc22e33d7d9bbafa01b8ef45ecb810f1ed12ad6c4817ff"
  },
  "week": {
    "MON": [
      {
        "start": "00:00",
        "end": "06:00",
        "state": "Minimum"
      },
      {
        "start": "06:00",
        "end": "09:30",
        "state": "Medium"
      },
      {
        "start": "09:30",
        "end": "00:00",
        "state": "Minimum"
      }
    ],
    "TUE": [
      {
        "start": "00:00",
        "end": "00:15",
        "state": "Minimum"
      },
      {
        "start": "00:15",
        "end": "08:45",
        "state": "Medium"
      },
      {
        "start": "08:45",
        "end": "00:00",
        "state": "Minimum"
      }
    ],
    "WED": [
      {
        "start": "00:00",
        "end": "00:00",
        "state": "Minimum"
      }
    ],
    "THU": [
      {
        "start": "00:00",
        "end": "00:00",
        "state": "Minimum"
      }
    ],
    "FRI": [
      {
        "start": "00:00",
        "end": "00:00",
        "state": "Minimum"
      }
    ],
    "SAT": [
      {
        "start": "00:00",
        "end": "00:00",
        "state": "Minimum"
      }
    ],
    "SUN": [
      {
        "start": "00:00",
        "end": "00:00",
        "state": "Minimum"
      }
    ]
  },
  "transitions": [
    {
      "time": "06:00",
      "days": [
        "MON"
      ],
      "state": "Medium",
      "cron": {
        "posix": "0 6 * * 1",
        "aws": "0 6 ? * MON *"
      }
    },
    {
      "time": "09:30",
      "days": [
        "MON"
      ],
      "state": "Minimum",
      "cron": {
        "posix": "30 9 * * 1",
        "aws": "30 9 ? * MON *"
      }
    },
    {
      "time": "00:15",
      "days": [
        "TUE"
      ],
      "state": "Medium",
      "cron": {
        "posix": "15 0 * * 2",
        "aws": "15 0 ? * TUE *"
      }
    },
    {
      "time": "08:45",
      "days": [
        "TUE"
      ],
      "state": "Minimum",
      "cron": {
        "posix": "45 8 * * 2",
        "aws": "45 8 ? * TUE *"
      }
    }
  ],
  "warnings": []
}
